Bus Hound 5.00 capture. Complements of www.perisoft.net

  Device - Device ID (followed by the endpoint for USB devices)
            (19) USB Composite Device
            (20) USB 打印支持
            (21) 没有连接打印机
            (22) USB 输入设备
            (23) HID-compliant device
  Phase  - Phase Type
            CTL   USB control transfer       
            DI    Data in                    
            DO    Data out                   
  Data   - Hex dump of the data transferred
  Descr  - Description of the phase
  Cmd... - Position in the captured data


Device  Phase  Data                                                                                                    Description       Cmd.Phase.Ofs(rep)
------  -----  ------------------------------------------------------------------------------------------------------  ----------------  ------------------
  19.0  CTL    80 06 00 01  00 00 12 00                                                                                GET DESCRIPTOR           1.1.0        
  19.0  DI     12 01 00 02  00 00 00 40  00 b0 11 04  00 02 01 02  03 01                                               .......@........         1.2.0        
  19.0  CTL    80 06 00 02  00 00 09 00                                                                                GET DESCRIPTOR           2.1.0        
  19.0  DI     09 02 20 00  01 01 00 c0  32                                                                            .. .....2                2.2.0        
  19.0  CTL    80 06 00 02  00 00 20 00                                                                                GET DESCRIPTOR           3.1.0        
  19.0  DI     09 02 20 00  01 01 00 c0  32 09 04 00  00 02 07 01  02 04 07 05  81 02 40 00  00 07 05 02  02 40 00 00  .. .....2.......         3.2.0        
  19.0  CTL    00 09 01 00  00 00 00 00                                                                                SET CONFIG               4.1.0        
  19.0  CTL    80 06 04 03  09 04 04 00                                                                                GET DESCRIPTOR           5.1.0        
  19.0  DI     01 04 00 00                                                                                             ....                     5.2.0        
  20.0  CTL    80 06 00 02  00 00 09 01                                                                                GET DESCRIPTOR           6.1.0        
  20.0  DO     09 02 20 00  01 01 00 c0  32 09 04 00  00 02 07 01  02 04 07 05  81 02 40 00  00 07 05 02  02 40 00 00  .. .....2.......         6.2.0        
  20.0  CTL    00 09 01 00  00 00 00 00                                                                                SET CONFIG               7.1.0        
  20.0  CTL    80 06 00 01  00 00 12 00                                                                                GET DESCRIPTOR           8.1.0        
  20.0  DO     12 01 00 02  00 00 00 40  00 b0 11 04  00 02 01 04  03 01                                               .......@........         8.2.0        
  20.0  CTL    a1 00 00 00  00 00 f1 03                                                                                GET DEVICE ID            9.1.0        
  20.0  DI     4d 46 47 3a  45 50 53 4f  4e 3b 43 4d  44 3a 45 4a  4c 2c 45 53  43 50 32 34  4a 2d 38 34  2c 45 53 43  MFG:EPSON;CMD:EJ         9.2.0        
               50 41 47 45  4a 2d 30 34  2c 45 53 43  50 53 55 50  45 52 2d 30  30 3b 4d 44  4c 3a 4c 50  2d 32 34 30  PAGEJ-04,ESCPSUP         9.2.32       
               4d 46 47 3a  45 50 53 4f  4e 3b 43 4d  44 3a 45 4a  4c 2c 45 53  43 50 32 34  4a 2d 38                  MFG:EPSON;CMD:EJ         9.2.64       
  19.0  CTL    80 06 00 02  00 00 09 00                                                                                GET DESCRIPTOR          10.1.0        
  19.0  DI     09 02 20 00  01 01 00 c0  32                                                                            .. .....2               10.2.0        
  19.0  CTL    80 06 00 02  00 00 20 00                                                                                GET DESCRIPTOR          11.1.0        
  19.0  DI     09 02 20 00  01 01 00 c0  32 09 04 00  00 02 07 01  02 04 07 05  81 02 40 00  00 07 05 02  02 40 00 00  .. .....2.......        11.2.0        
  20.2  DO     1b 40 1b 4a  78 1d 76 30  00 30 00 18  00 00 00 00  00 00 00 00  00 00 00 00  00 00 00 00  00 00 00 00  .@.Jx.v0.0......        12.1.0        
               00 00 00 00  00 00 00 00  00 00 00 00  00 00 00 00  00 00 00 00  00 00 00 00  00 00 00 00  00 00 00 00  ................        12.1.32       
               00 00 00 00  00 00 00 00  00 00 00 00  00 00 00 00  00 00 00 00  00 00 00 00  00 00 00 00  00 00 00 00  ................        12.1.64       
               00 00 00 00  00 00 00 00  00 00 00 00  00 00 00 00  00 00 00 00  00 00 00 00  00 00 00 00  00 00 00 00  ................        12.1.96       
               00 00 00 00  00 00 00 00  00 00 00 00  00 00 00 00  00 00 00 00  00 00 00 00  00 00 00 00  00 00 00 00  ................        12.1.128      
               00 00 00 00  00 00 00 00  00 00 00 00  00 00 00 00  00 00 00 00  00 00 00 00  00 00 00 00  00 00 00 00  ................        12.1.160      
               00 00 00 00  00 00 00 00  00 00 00 00  00 00 00 00  00 00 00 00  00 00 00 00  00 00 00 00  00 00 00 00  ................        12.1.192      
               00 00 00 00  00 00 00 00  00 00 00 00  00 00 00 00  00 00 00 00  00 00 00 00  00 00 00 00  00 00 00 00  ................        12.1.224      
               00 00 00 00  00 00 00 00  00 00 00 00  00 00 00 00  00 00 00 00  00 00 00 00  00 00 00 00  00 00 00 00  ................        12.1.256      
               00 00 00 00  00 00 00 00  00 00 00 00  00 00 00 00  00 00 00 00  00 00 00 00  00 00 00 00  00 00 00 00  ................        12.1.288      
               00 00 00 00  00 00 00 00  00 00 00 00  00 00 00 00  00 00 00 00  00 00 00 00  00 00 00 00  00 00 00 00  ................        12.1.320      
               00 00 00 00  00 00 00 00  00 00 00 00  00 00 00 00  00 00 00 00  00 00 00 00  00 00 00 00  00 00 00 00  ................        12.1.352      
               00 00 00 00  00 00 00 00  00 00 00 00  00 00 00 00  00 00 00 00  00 00 00 00  00 00 00 00  00 00 00 00  ................        12.1.384      
               00 00 00 00  00 00 00 00  00 00 00 00  00 00 00 00  00 00 00 00  00 00 00 00  00 00 00 00  00 00 00 00  ................        12.1.416      
               00 00 00 00  00 00 00 00  00 00 00 00  00 00 00 00  00 00 00 00  00 00 00 00  00 00 00 00  00 00 00 00  ................        12.1.448      
               00 00 00 00  00 00 00 00  00 00 00 00  00 00 00 00  00 00 00 00  00 00 00 00  00 00 00 00  00 00 00 00  ................        12.1.480      
  20.2  DO     1b 4a 78 1b  40                                                                                         .Jx.@                   13.1.0        
  20.2  DO     1b 40 1b 4a  78 1d 76 30  00 30 00 18  00 00 00 00  00 00 00 00  00 00 00 00  00 00 00 00  00 00 00 00  .@.Jx.v0.0......        14.1.0        
               00 00 00 00  00 00 00 00  00 00 00 00  00 00 00 00  00 00 00 00  00 00 00 00  00 00 00 00  00 00 00 00  ................        14.1.32       
               00 00 00 00  00 00 00 00  00 00 00 00  00 00 00 00  00 00 00 00  00 00 00 00  00 00 00 00  00 00 00 00  ................        14.1.64       
               00 00 00 00  00 00 00 00  00 00 00 00  00 00 00 00  00 00 00 00  00 00 00 00  00 00 00 00  00 00 00 00  ................        14.1.96       
               00 00 00 00  00 00 00 00  00 00 00 00  00 00 00 00  00 00 00 00  00 00 00 00  00 00 00 00  00 00 00 00  ................        14.1.128      
               00 00 00 00  00 00 00 00  00 00 00 00  00 00 00 00  00 00 00 00  00 00 00 00  00 00 00 00  00 00 00 00  ................        14.1.160      
               00 00 00 00  00 00 00 00  00 00 00 00  00 00 00 00  00 00 00 00  00 00 00 00  00 00 00 00  00 00 00 00  ................        14.1.192      
               00 00 00 00  00 00 00 00  00 00 00 00  00 00 00 00  00 00 00 00  00 00 00 00  00 00 00 00  00 00 00 00  ................        14.1.224      
               00 00 00 00  00 00 00 00  00 00 00 00  00 00 00 00  00 00 00 00  00 00 00 00  00 00 00 00  00 00 00 00  ................        14.1.256      
               00 00 00 00  00 00 00 00  00 00 00 00  00 00 00 00  00 00 00 00  00 00 00 00  00 00 00 00  00 00 00 00  ................        14.1.288      
               00 00 00 00  00 00 00 00  00 00 00 00  00 00 00 00  00 00 00 00  00 00 00 00  00 00 00 00  00 00 00 00  ................        14.1.320      
               00 00 00 00  00 00 00 00  00 00 00 00  00 00 00 00  00 00 00 00  00 00 00 00  00 00 00 00  00 00 00 00  ................        14.1.352      
               00 00 00 00  00 00 00 00  00 00 00 00  00 00 00 00  00 00 00 00  00 00 00 00  00 00 00 00  00 00 00 00  ................        14.1.384      
               00 00 00 00  00 00 00 00  00 00 00 00  00 00 00 00  00 00 00 00  00 00 00 00  00 00 00 00  00 00 00 00  ................        14.1.416      
               00 00 00 00  00 00 00 00  00 00 00 00  00 00 00 00  00 00 00 00  00 00 00 00  00 00 00 00  00 00 00 00  ................        14.1.448      
               00 00 00 00  00 00 00 00  00 00 00 00  00 00 00 00  00 00 00 00  00 00 00 00  00 00 00 00  00 00 00 00  ................        14.1.480      
  20.2  DO     1b 4a 78 1b  40                                                                                         .Jx.@                   15.1.0        
  20.2  DO     1b 40 1b 4a  78 1d 76 30  00 30 00 18  00 00 00 00  00 00 00 00  00 00 00 00  00 00 00 00  00 00 00 00  .@.Jx.v0.0......        16.1.0        
               00 00 00 00  00 00 00 00  00 00 00 00  00 00 00 00  00 00 00 00  00 00 00 00  00 00 00 00  00 00 00 00  ................        16.1.32       
               00 00 00 00  00 00 00 00  00 00 00 00  00 00 00 00  00 00 00 00  00 00 00 00  00 00 00 00  00 00 00 00  ................        16.1.64       
               00 00 00 00  00 00 00 00  00 00 00 00  00 00 00 00  00 00 00 00  00 00 00 00  00 00 00 00  00 00 00 00  ................        16.1.96       
               00 00 00 00  00 00 00 00  00 00 00 00  00 00 00 00  00 00 00 00  00 00 00 00  00 00 00 00  00 00 00 00  ................        16.1.128      
               00 00 00 00  00 00 00 00  00 00 00 00  00 00 00 00  00 00 00 00  00 00 00 00  00 00 00 00  00 00 00 00  ................        16.1.160      
               00 00 00 00  00 00 00 00  00 00 00 00  00 00 00 00  00 00 00 00  00 00 00 00  00 00 00 00  00 00 00 00  ................        16.1.192      
               00 00 00 00  00 00 00 00  00 00 00 00  00 00 00 00  00 00 00 00  00 00 00 00  00 00 00 00  00 00 00 00  ................        16.1.224      
               00 00 00 00  00 00 00 00  00 00 00 00  00 00 00 00  00 00 00 00  00 00 00 00  00 00 00 00  00 00 00 00  ................        16.1.256      
               00 00 00 00  00 00 00 00  00 00 00 00  00 00 00 00  00 00 00 00  00 00 00 00  00 00 00 00  00 00 00 00  ................        16.1.288      
               00 00 00 00  00 00 00 00  00 00 00 00  00 00 00 00  00 00 00 00  00 00 00 00  00 00 00 00  00 00 00 00  ................        16.1.320      
               00 00 00 00  00 00 00 00  00 00 00 00  00 00 00 00  00 00 00 00  00 00 00 00  00 00 00 00  00 00 00 00  ................        16.1.352      
               00 00 00 00  00 00 00 00  00 00 00 00  00 00 00 00  00 00 00 00  00 00 00 00  00 00 00 00  00 00 00 00  ................        16.1.384      
               00 00 00 00  00 00 00 00  00 00 00 00  00 00 00 00  00 00 00 00  00 00 00 00  00 00 00 00  00 00 00 00  ................        16.1.416      
               00 00 00 00  00 00 00 00  00 00 00 00  00 00 00 00  00 00 00 00  00 00 00 00  00 00 00 00  00 00 00 00  ................        16.1.448      
               00 00 00 00  00 00 00 00  00 00 00 00  00 00 00 00  00 00 00 00  00 00 00 00  00 00 00 00  00 00 00 00  ................        16.1.480      
  20.2  DO     1b 4a 78 1b  40                                                                                         .Jx.@                   17.1.0        
  20.2  DO     1b 40 1b 4a  78 1d 76 30  00 30 00 18  00 00 00 00  00 00 00 00  00 00 00 00  00 00 00 00  00 00 00 00  .@.Jx.v0.0......        18.1.0        
               00 00 00 00  00 00 00 00  00 00 00 00  00 00 00 00  00 00 00 00  00 00 00 00  00 00 00 00  00 00 00 00  ................        18.1.32       
               00 00 00 00  00 00 00 00  00 00 00 00  00 00 00 00  00 00 00 00  00 00 00 00  00 00 00 00  00 00 00 00  ................        18.1.64       
               00 00 00 00  00 00 00 00  00 00 00 00  00 00 00 00  00 00 00 00  00 00 00 00  00 00 00 00  00 00 00 00  ................        18.1.96       
               00 00 00 00  00 00 00 00  00 00 00 00  00 00 00 00  00 00 00 00  00 00 00 00  00 00 00 00  00 00 00 00  ................        18.1.128      
               00 00 00 00  00 00 00 00  00 00 00 00  00 00 00 00  00 00 00 00  00 00 00 00  00 00 00 00  00 00 00 00  ................        18.1.160      
               00 00 00 00  00 00 00 00  00 00 00 00  00 00 00 00  00 00 00 00  00 00 00 00  00 00 00 00  00 00 00 00  ................        18.1.192      
               00 00 00 00  00 00 00 00  00 00 00 00  00 00 00 00  00 00 00 00  00 00 00 00  00 00 00 00  00 00 00 00  ................        18.1.224      
               00 00 00 00  00 00 00 00  00 00 00 00  00 00 00 00  00 00 00 00  00 00 00 00  00 00 00 00  00 00 00 00  ................        18.1.256      
               00 00 00 00  00 00 00 00  00 00 00 00  00 00 00 00  00 00 00 00  00 00 00 00  00 00 00 00  00 00 00 00  ................        18.1.288      
               00 00 00 00  00 00 00 00  00 00 00 00  00 00 00 00  00 00 00 00  00 00 00 00  00 00 00 00  00 00 00 00  ................        18.1.320      
               00 00 00 00  00 00 00 00  00 00 00 00  00 00 00 00  00 00 00 00  00 00 00 00  00 00 00 00  00 00 00 00  ................        18.1.352      
               00 00 00 00  00 00 00 00  00 00 00 00  00 00 00 00  00 00 00 00  00 00 00 00  00 00 00 00  00 00 00 00  ................        18.1.384      
               00 00 00 00  00 00 00 00  00 00 00 00  00 00 00 00  00 00 00 00  00 00 00 00  00 00 00 00  00 00 00 00  ................        18.1.416      
               00 00 00 00  00 00 00 00  00 00 00 00  00 00 00 00  00 00 00 00  00 00 00 00  00 00 00 00  00 00 00 00  ................        18.1.448      
               00 00 00 00  00 00 00 00  00 00 00 00  00 00 00 00  00 00 00 00  00 00 00 00  00 00 00 00  00 00 00 00  ................        18.1.480      
  20.2  DO     1b 4a 78 1b  40                                                                                         .Jx.@                   19.1.0        
