Bus Hound 5.00 capture. Complements of www.perisoft.net

  Device - Device ID (followed by the endpoint for USB devices)
            (16) USB Composite Device
            (17) USB 打印支持
            (18) USB 输入设备
            (19) 没有连接打印机
            (20) HID-compliant device
  Phase  - Phase Type
            CTL   USB control transfer       
            DI    Data in                    
            DO    Data out                   
            USTS  USB status                 
  Data   - Hex dump of the data transferred
  Descr  - Description of the phase
  Cmd... - Position in the captured data


Device  Phase  Data                                                                                                    Description       Cmd.Phase.Ofs(rep)
------  -----  ------------------------------------------------------------------------------------------------------  ----------------  ------------------
  17.0  CTL    00 09 00 00  00 00 00 00                                                                                SET CONFIG               1.1.0        
  16.0  CTL    80 06 00 01  00 00 12 00                                                                                GET DESCRIPTOR           2.1.0        
  16.0  DI     12 01 00 02  00 00 00 40  00 b0 11 04  00 02 01 02  00 01                                               .......@........         2.2.0        
  16.0  CTL    80 06 00 02  00 00 09 00                                                                                GET DESCRIPTOR           3.1.0        
  16.0  DI     09 02 39 00  02 01 00 c0  32                                                                            ..9.....2                3.2.0        
  16.0  CTL    80 06 00 02  00 00 39 00                                                                                GET DESCRIPTOR           4.1.0        
  16.0  DI     09 02 39 00  02 01 00 c0  32 09 04 00  00 01 07 01  02 00 07 05  01 02 40 00  00 09 04 01  00 02 03 00  ..9.....2.......         4.2.0        
               00 03 09 21  10 01 00 01  22 1b 00 07  05 82 03 40  00 01 07 05  03 03 40 00  01                        ...!...."......@         4.2.32       
  16.0  CTL    00 09 01 00  00 00 00 00                                                                                SET CONFIG               5.1.0        
  16.0  CTL    80 06 02 03  09 04 04 00                                                                                GET DESCRIPTOR           6.1.0        
  16.0  DI     12 03 50 00                                                                                             ..P.                     6.2.0        
  16.0  CTL    80 06 02 03  09 04 12 00                                                                                GET DESCRIPTOR           7.1.0        
  16.0  DI     12 03 50 00  4f 00 53 00  35 00 38 00  39 00 30 00  55 00                                               ..P.O.S.5.8.9.0.         7.2.0        
  16.0  CTL    80 06 03 03  09 04 04 00                                                                                GET DESCRIPTOR           8.1.0        
  16.0  DI     10 03 55 00                                                                                             ..U.                     8.2.0        
  16.0  CTL    80 06 03 03  09 04 10 00                                                                                GET DESCRIPTOR           9.1.0        
  16.0  DI     10 03 55 00  70 00 67 00  72 00 61 00  64 00 65 00                                                      ..U.p.g.r.a.d.e.         9.2.0        
  17.0  CTL    80 06 00 02  00 00 09 01                                                                                GET DESCRIPTOR          10.1.0        
  17.0  DO     09 02 19 00  01 01 00 c0  32 09 04 00  00 01 07 01  02 00 07 05  01 02 40 00  00                        ........2.......        10.2.0        
  17.0  CTL    00 09 01 00  00 00 00 00                                                                                SET CONFIG              11.1.0        
  17.0  CTL    80 06 00 01  00 00 12 00                                                                                GET DESCRIPTOR          12.1.0        
  17.0  DO     12 01 00 02  00 00 00 40  00 b0 11 04  00 02 01 02  00 01                                               .......@........        12.2.0        
  17.0  CTL    a1 00 00 00  00 00 f1 03                                                                                GET DEVICE ID           13.1.0        
  17.0  USTS   00 00 01 c0                                                                                             canceled                13.2.0        
